[
 {
  "candidates": [],
  "candidates_other_p": 0.0,
  "confidence": 1.0,
  "confidence_kind": "deterministic_rule",
  "evidence": [
   {
    "name": "night_min_flow",
    "unit": "L/min",
    "value": 16.25
   },
   {
    "name": "nights_above_threshold",
    "value": 1.0
   },
   {
    "name": "threshold",
    "unit": "L/min",
    "value": 0.02
   }
  ],
  "first_seen": "2026-10-27T04:00:00+08:00",
  "house_id": "elmina_g6_demo",
  "id": "fnd_7994c38d49153321db69",
  "key": "L1:night_flow_unexplained:meter_water_main",
  "last_seen": "2026-10-27T04:00:00+08:00",
  "layer": "L1",
  "object_ids": [],
  "quantities": {
   "water_l_per_day": {
    "unit": "L/day",
    "value": 23400.0
   }
  },
  "revision": 1,
  "schema_version": "1.0",
  "series_refs": [
   {
    "bucket_s": 900.0,
    "stream": "water.main.flow_lpm",
    "window": {
     "from": "2026-10-27T02:00:00+08:00",
     "to": "2026-10-27T04:00:00+08:00"
    }
   }
  ],
  "severity": "heads_up",
  "severity_floor": false,
  "source": {
   "detector": "l1_mnf_baseline",
   "kind": "baseline",
   "version": "1.0.0"
  },
  "status": "active",
  "type": "night_flow_unexplained",
  "updated_at": "2026-10-27T04:00:00+08:00"
 },
 {
  "candidates": [],
  "candidates_other_p": 0.0,
  "confidence": 1.0,
  "confidence_kind": "deterministic_rule",
  "evidence": [
   {
    "name": "mean_flow",
    "unit": "L/min",
    "value": 16.0
   },
   {
    "name": "window",
    "unit": "min",
    "value": 60.0
   },
   {
    "name": "rule",
    "value": "continuous_high_flow"
   }
  ],
  "first_seen": "2026-10-26T22:04:50+08:00",
  "house_id": "elmina_g6_demo",
  "id": "fnd_17a297d9624f7c7607bc",
  "key": "L1:burst_pipe:meter_water_main",
  "last_seen": "2026-10-26T22:04:50+08:00",
  "layer": "L1",
  "object_ids": [
   "meter_water_main"
  ],
  "quantities": {
   "water_l_per_day": {
    "unit": "L/day",
    "value": 23040.0
   }
  },
  "revision": 1,
  "safety_guidance_key": "sg_burst_pipe",
  "schema_version": "1.0",
  "series_refs": [],
  "severity": "urgent",
  "severity_floor": false,
  "source": {
   "detector": "l1_burst_rule",
   "kind": "rule",
   "version": "1.0.0"
  },
  "status": "active",
  "type": "burst_pipe_suspected",
  "updated_at": "2026-10-26T22:04:50+08:00"
 }
]