[
 {
  "candidates": [],
  "candidates_other_p": 0.0,
  "confidence": 1.0,
  "confidence_kind": "deterministic_rule",
  "evidence": [
   {
    "name": "night_min_flow",
    "unit": "L/min",
    "value": 0.7053
   },
   {
    "name": "nights_above_threshold",
    "value": 7.0
   },
   {
    "name": "threshold",
    "unit": "L/min",
    "value": 0.02
   }
  ],
  "first_seen": "2026-10-19T04:00:00+08:00",
  "house_id": "elmina_g6_demo",
  "id": "fnd_bcd02038b75d1daded2c",
  "key": "L1:night_flow_unexplained:meter_water_main",
  "last_seen": "2026-10-25T04:00:00+08:00",
  "layer": "L1",
  "object_ids": [],
  "quantities": {
   "water_l_per_day": {
    "unit": "L/day",
    "value": 1015.7
   }
  },
  "revision": 7,
  "schema_version": "1.0",
  "series_refs": [
   {
    "bucket_s": 900.0,
    "stream": "water.main.flow_lpm",
    "window": {
     "from": "2026-10-25T02:00:00+08:00",
     "to": "2026-10-25T04:00:00+08:00"
    }
   }
  ],
  "severity": "heads_up",
  "severity_floor": false,
  "source": {
   "detector": "l1_mnf_baseline",
   "kind": "baseline",
   "version": "1.0.0"
  },
  "status": "active",
  "type": "night_flow_unexplained",
  "updated_at": "2026-10-25T04:00:00+08:00"
 }
]